id,title,summary,full_text,link,source,category,subcategory,location,impact,severity,keywords,timestamp,processed_at
1765366800177,Case against Yoshitha and grandmother adjourned pending Daisy Forrests medical report,"The Attorney General informed the Colombo High Court today (10) that Daisy Forrest, the grandmother of Yoshitha Rajapaksa and a defendant in a case filed under the Prevention of Money Laundering Act, is scheduled to undergo a psychiatric medical report tomorrow by the Colombo Judicial Medical Officer. MORE..",🔴LIVE | Ada Derana Midday Prime News Bulletin,https://www.adaderana.lk/news/115831/case-against-yoshitha-and-grandmother-adjourned-pending-daisy-forrests-medical-report,ada_derana,crime,court_legal_updates,Colombo,Law enforcement update for public information.,info,[],2025-12-10T17:10:00.177607,2025-12-10T17:10:00.177654
1765366800178,Homeowners in landslide-prone areas provided with reports on risk level: NBRO,The National Building Research Organisation (NBRO) has extended landslide warnings issued to several areas based on current ground conditions and weather forecasts. MORE..,🔴LIVE | Ada Derana Midday Prime News Bulletin,https://www.adaderana.lk/news/115830/homeowners-in-landslide-prone-areas-provided-with-reports-on-risk-level-nbro-,ada_derana,weather,landslides,Sri Lanka,Weather-related disruptions expected. Stay informed about updates.,medium,[],2025-12-10T17:10:00.178439,2025-12-10T17:10:00.178498
1765366800180,Heavy vehicles barred from using road over Kotmale Dam: Mahaweli Authority,"Heavy vehicles have been barred from using the road over the Kotmale Dam, the Mahaweli Development Authority (MDA) has announced. MORE..",🔴LIVE | Ada Derana Midday Prime News Bulletin,https://www.adaderana.lk/news/115829/heavy-vehicles-barred-from-using-road-over-kotmale-dam-mahaweli-authority,ada_derana,traffic,road_accident,Sri Lanka,Traffic information update for public awareness.,info,[],2025-12-10T17:10:00.180075,2025-12-10T17:10:00.180129
1765366800180,Kolonna Pradeshiya Sabhas budget defeated for the second time,"The annual budget of the Kolonna Pradeshiya Sabha, which is controlled by the National Peoples Power (NPP), has been defeated for the second time. MORE..",🔴LIVE | Ada Derana Midday Prime News Bulletin,https://www.adaderana.lk/news/115828/kolonna-pradeshiya-sabhas-budget-defeated-for-the-second-time,ada_derana,general,general_news,Sri Lanka,General news update for public information,info,[],2025-12-10T17:10:00.180576,2025-12-10T17:10:00.180637
1765366800181,Family dog assists in locating bodies of seven victims in Ambokka landslide,"Highlands surrounding the Ambokka village within the Pallepola Divisional Secretariat area in Matale, have reportedly become increasingly unstable following recent heavy rains. MORE..",🔴LIVE | Ada Derana Midday Prime News Bulletin,https://www.adaderana.lk/news/115827/family-dog-assists-in-locating-bodies-of-seven-victims-in-ambokka-landslide,ada_derana,weather,rainfall_alerts,Sri Lanka,Weather advisory in effect. Minor inconveniences possible.,low,[],2025-12-10T17:10:00.181396,2025-12-10T17:10:00.181456
1765366800182,H-1B visa appointments postponed for many Indians amid US Social Media rules,The US State Departments new social media vetting policy has triggered massive disruptions for H-1B visa applicants in India as many appointments have been postponed to next year. The US Embassy in India issued an advisory to the visa applicants on Tuesday night. MORE..,🔴LIVE | Ada Derana Midday Prime News Bulletin,https://www.adaderana.lk/news/115826/h-1b-visa-appointments-postponed-for-many-indians-amid-us-social-media-rules,ada_derana,government,government_general,Sri Lanka,Policy changes announced. Impact on services expected.,medium,[],2025-12-10T17:10:00.182847,2025-12-10T17:10:00.182980
1765366800186,Google Maps begins updating Sri Lankas road network  Minister,"Google Maps has commenced updating information pertaining Sri Lankas road network covering around 12,000 kilometers, Minister of Transport Bimal Ratnayake has stated. MORE..",🔴LIVE | Ada Derana Midday Prime News Bulletin,https://www.adaderana.lk/news/115825/google-maps-begins-updating-sri-lankas-road-network-minister,ada_derana,traffic,bus_issues,Sri Lanka,Traffic information update for public awareness.,info,[],2025-12-10T17:10:00.186566,2025-12-10T17:10:00.186652
1765366800188,"Rebuilding Sri Lanka Fund receives Rs. 1,893 million thus far","The Rebuilding Sri Lanka programme, initiated to restore the country following the damage caused by Cyclone Ditwah, has received a total of Rs. 1,893 million in funding from domestic sources, overseas Sri Lankans, and various institutions, the Secretary to the Ministry of Finance, Dr. Harshana Suriyapperuma has stated. MORE..",🔴LIVE | Ada Derana Midday Prime News Bulletin,https://www.adaderana.lk/news/115824/rebuilding-sri-lanka-fund-receives-rs-1893-million-thus-far,ada_derana,weather,cyclones,Sri Lanka,Weather advisory in effect. Minor inconveniences possible.,low,[],2025-12-10T17:10:00.188238,2025-12-10T17:10:00.188395
1765366800189,"Over 50,000 tourists arrive in first eight days of December","A total of 50,222 tourists have arrived in the country thus far in December, data from the Sri Lanka Tourism Development Authority (SLTDA) shows. MORE..",🔴LIVE | Ada Derana Midday Prime News Bulletin,https://www.adaderana.lk/news/115823/over-50000-tourists-arrive-in-first-eight-days-of-december,ada_derana,general,general_news,Sri Lanka,General news update for public information,info,[],2025-12-10T17:10:00.189596,2025-12-10T17:10:00.189746
1765366800191,"Landslide in Bogahapathana, no injuries or casualties reported","A landslide has been reported in Bogahapathana, Meegahakiula. MORE..",🔴LIVE | Ada Derana Midday Prime News Bulletin,https://www.adaderana.lk/news/115821/landslide-in-bogahapathana-no-injuries-or-casualties-reported,ada_derana,weather,landslides,Sri Lanka,Weather advisory in effect. Minor inconveniences possible.,low,[],2025-12-10T17:10:00.191250,2025-12-10T17:10:00.191368
1765366800192,"Britain sanctions Russian, Chinese entities over disinfo, cyber threats",Britain on Tuesday (Dec 9) sanctioned entities it accused of distorting information in favour of Russia as well as two Chinese companies for alleged cyber activities against the United Kingdom and its allies. MORE..,🔴LIVE | Ada Derana Midday Prime News Bulletin,https://www.adaderana.lk/news/115820/britain-sanctions-russian-chinese-entities-over-disinfo-cyber-threats,ada_derana,general,general_news,Sri Lanka,General news update for public information,info,[],2025-12-10T17:10:00.192522,2025-12-10T17:10:00.192646
1765366800194,Youth succumbs following sudden explosion at fireworks factory in Katana,"A youth has died following a sudden explosion at a fireworks manufacturing factory in Kimbulapitiya, Katana, police stated. MORE..",🔴LIVE | Ada Derana Midday Prime News Bulletin,https://www.adaderana.lk/news/115818/youth-succumbs-following-sudden-explosion-at-fireworks-factory-in-katana,ada_derana,safety,fires,Sri Lanka,Safety advisory issued. Public advised to remain vigilant.,low,[],2025-12-10T17:10:00.194134,2025-12-10T17:10:00.194250
1765366800196,Individual arrested over theft of telecom transmission cables in Rambukkana,"An individual has been arrested in connection with the theft of cables installed on a telecommunication transmission tower located in Yatagama, Rambukkana, police stated. MORE..",🔴LIVE | Ada Derana Midday Prime News Bulletin,https://www.adaderana.lk/news/115817/individual-arrested-over-theft-of-telecom-transmission-cables-in-rambukkana,ada_derana,crime,arrests,Sri Lanka,Minor criminal incident reported. Increased police presence.,low,[],2025-12-10T17:10:00.196172,2025-12-10T17:10:00.196326
1765366958765,Russias first aircraft carrying 35 tons of humanitarian aid arrives in Sri Lanka,Russia has dispatched a consignment of 35 metric tons of humanitarian aid to Sri Lanka following the impact of Cyclone Ditwah. MORE..,🔴LIVE | Ada Derana Midday Prime News Bulletin,https://www.adaderana.lk/news/115838/russias-first-aircraft-carrying-35-tons-of-humanitarian-aid-arrives-in-sri-lanka,ada_derana,weather,cyclones,Sri Lanka,Weather information update for planning purposes.,info,[],2025-12-10T17:12:38.765721,2025-12-10T17:12:38.765783
1765366958766,Australia and UNFPA partner to protect women and girls in cyclone-affected Sri Lanka,"Australia and the United Nations Population Fund (UNFPA) have partnered to deliver urgent humanitarian assistance to protect women and girls across Sri Lanka, affected by catastrophic floods and landslides triggered by Cyclone Ditwah, one of the most devastating climate-related disasters to strike the island nation in recent years. MORE..",🔴LIVE | Ada Derana Midday Prime News Bulletin,https://www.adaderana.lk/news/115837/australia-and-unfpa-partner-to-protect-women-and-girls-in-cyclone-affected-sri-lanka,ada_derana,weather,floods,Sri Lanka,Severe weather conditions posing risks to public safety. Follow official warnings.,high,[],2025-12-10T17:12:38.766743,2025-12-10T17:12:38.766793
1765366958768,Deepavali inscribed on UNESCOs Intangible Cultural Heritage list,"Deepavali  the festival of lights  was on Wednesday (December 10, 2025) inscribed on the UNESCOs Representative List of the Intangible Cultural Heritage of Humanity, sparking celebrations to mark the earning of the coveted tag. MORE..",🔴LIVE | Ada Derana Midday Prime News Bulletin,https://www.adaderana.lk/news/115836/deepavali-inscribed-on-unescos-intangible-cultural-heritage-list,ada_derana,community,community_general,Sri Lanka,General information update for public awareness.,info,[],2025-12-10T17:12:38.768029,2025-12-10T17:12:38.768074
1765366958768,UAE continues to send aid to assist flood-hit Sri Lanka,The UAEs eight humanitarian aid aircraft has arrived in Sri Lanka on Tuesday in efforts to support the country following deadly floods and landslides. MORE..,🔴LIVE | Ada Derana Midday Prime News Bulletin,https://www.adaderana.lk/news/115835/uae-continues-to-send-aid-to-assist-flood-hit-sri-lanka,ada_derana,weather,floods,Sri Lanka,Severe weather conditions posing risks to public safety. Follow official warnings.,high,[],2025-12-10T17:12:38.768972,2025-12-10T17:12:38.769034
1765366958770,Advisory issued for severe lightning,An Amber advisory has been issued by the Department of Meteorology for severe lightning in the Western and Sabaragamuwa provinces and in Galle and Matara Districts. MORE..,🔴LIVE | Ada Derana Midday Prime News Bulletin,https://www.adaderana.lk/news/115834/advisory-issued-for-severe-lightning,ada_derana,general,general_news,Sri Lanka,General news update for public information,info,[],2025-12-10T17:12:38.770507,2025-12-10T17:12:38.770554
1765366958771,"Significant flooding reported after heavy rainfall in Jeddah, Saudi Arabia","Jeddah, Saudi Arabia has experienced heavy rainfall that has led to significant flooding and traffic congestion across the city. MORE..",🔴LIVE | Ada Derana Midday Prime News Bulletin,https://www.adaderana.lk/news/115833/significant-flooding-reported-after-heavy-rainfall-in-jeddah-saudi-arabia,ada_derana,weather,rainfall_alerts,Sri Lanka,Weather-related disruptions expected. Stay informed about updates.,medium,[],2025-12-10T17:12:38.771725,2025-12-10T17:12:38.771782
1765366958774,Ex-Central Bank Governor Ajith Nivard Cabraal and three others acquitted in Greek Bond case,Former Central Bank Governor Ajith Nivard Cabraal has been released from the case pertaining to the 2012 purchase of Greek Bonds. MORE..,🔴LIVE | Ada Derana Midday Prime News Bulletin,https://www.adaderana.lk/news/115832/ex-central-bank-governor-ajith-nivard-cabraal-and-three-others-acquitted-in-greek-bond-case,ada_derana,general,general_news,Sri Lanka,General news update for public information,info,[],2025-12-10T17:12:38.774432,2025-12-10T17:12:38.774479
1765366958775,Case against Yoshitha and grandmother adjourned pending Daisy Forrests medical report,"The Attorney General informed the Colombo High Court today (10) that Daisy Forrest, the grandmother of Yoshitha Rajapaksa and a defendant in a case filed under the Prevention of Money Laundering Act, is scheduled to undergo a psychiatric medical report tomorrow by the Colombo Judicial Medical Officer. MORE..",🔴LIVE | Ada Derana Midday Prime News Bulletin,https://www.adaderana.lk/news/115831/case-against-yoshitha-and-grandmother-adjourned-pending-daisy-forrests-medical-report,ada_derana,crime,court_legal_updates,Colombo,Law enforcement update for public information.,info,[],2025-12-10T17:12:38.775214,2025-12-10T17:12:38.775299
1765366958777,Homeowners in landslide-prone areas provided with reports on risk level: NBRO,The National Building Research Organisation (NBRO) has extended landslide warnings issued to several areas based on current ground conditions and weather forecasts. MORE..,🔴LIVE | Ada Derana Midday Prime News Bulletin,https://www.adaderana.lk/news/115830/homeowners-in-landslide-prone-areas-provided-with-reports-on-risk-level-nbro-,ada_derana,weather,landslides,Sri Lanka,Weather-related disruptions expected. Stay informed about updates.,medium,[],2025-12-10T17:12:38.777479,2025-12-10T17:12:38.777528
1765366958779,Heavy vehicles barred from using road over Kotmale Dam: Mahaweli Authority,"Heavy vehicles have been barred from using the road over the Kotmale Dam, the Mahaweli Development Authority (MDA) has announced. MORE..",🔴LIVE | Ada Derana Midday Prime News Bulletin,https://www.adaderana.lk/news/115829/heavy-vehicles-barred-from-using-road-over-kotmale-dam-mahaweli-authority,ada_derana,traffic,road_accident,Sri Lanka,Traffic information update for public awareness.,info,[],2025-12-10T17:12:38.779266,2025-12-10T17:12:38.779357
1765366958782,Kolonna Pradeshiya Sabhas budget defeated for the second time,"The annual budget of the Kolonna Pradeshiya Sabha, which is controlled by the National Peoples Power (NPP), has been defeated for the second time. MORE..",🔴LIVE | Ada Derana Midday Prime News Bulletin,https://www.adaderana.lk/news/115828/kolonna-pradeshiya-sabhas-budget-defeated-for-the-second-time,ada_derana,general,general_news,Sri Lanka,General news update for public information,info,[],2025-12-10T17:12:38.782906,2025-12-10T17:12:38.783105
1765366958785,Family dog assists in locating bodies of seven victims in Ambokka landslide,"Highlands surrounding the Ambokka village within the Pallepola Divisional Secretariat area in Matale, have reportedly become increasingly unstable following recent heavy rains. MORE..",🔴LIVE | Ada Derana Midday Prime News Bulletin,https://www.adaderana.lk/news/115827/family-dog-assists-in-locating-bodies-of-seven-victims-in-ambokka-landslide,ada_derana,weather,rainfall_alerts,Sri Lanka,Weather advisory in effect. Minor inconveniences possible.,low,[],2025-12-10T17:12:38.785846,2025-12-10T17:12:38.786035
1765366958788,H-1B visa appointments postponed for many Indians amid US Social Media rules,The US State Departments new social media vetting policy has triggered massive disruptions for H-1B visa applicants in India as many appointments have been postponed to next year. The US Embassy in India issued an advisory to the visa applicants on Tuesday night. MORE..,🔴LIVE | Ada Derana Midday Prime News Bulletin,https://www.adaderana.lk/news/115826/h-1b-visa-appointments-postponed-for-many-indians-amid-us-social-media-rules,ada_derana,government,government_general,Sri Lanka,Policy changes announced. Impact on services expected.,medium,[],2025-12-10T17:12:38.787974,2025-12-10T17:12:38.788122
1765366958792,Google Maps begins updating Sri Lankas road network  Minister,"Google Maps has commenced updating information pertaining Sri Lankas road network covering around 12,000 kilometers, Minister of Transport Bimal Ratnayake has stated. MORE..",🔴LIVE | Ada Derana Midday Prime News Bulletin,https://www.adaderana.lk/news/115825/google-maps-begins-updating-sri-lankas-road-network-minister,ada_derana,traffic,bus_issues,Sri Lanka,Traffic information update for public awareness.,info,[],2025-12-10T17:12:38.792157,2025-12-10T17:12:38.792334
1765366958794,"Rebuilding Sri Lanka Fund receives Rs. 1,893 million thus far","The Rebuilding Sri Lanka programme, initiated to restore the country following the damage caused by Cyclone Ditwah, has received a total of Rs. 1,893 million in funding from domestic sources, overseas Sri Lankans, and various institutions, the Secretary to the Ministry of Finance, Dr. Harshana Suriyapperuma has stated. MORE..",🔴LIVE | Ada Derana Midday Prime News Bulletin,https://www.adaderana.lk/news/115824/rebuilding-sri-lanka-fund-receives-rs-1893-million-thus-far,ada_derana,weather,cyclones,Sri Lanka,Weather advisory in effect. Minor inconveniences possible.,low,[],2025-12-10T17:12:38.794305,2025-12-10T17:12:38.794454
1765366958797,"Over 50,000 tourists arrive in first eight days of December","A total of 50,222 tourists have arrived in the country thus far in December, data from the Sri Lanka Tourism Development Authority (SLTDA) shows. MORE..",🔴LIVE | Ada Derana Midday Prime News Bulletin,https://www.adaderana.lk/news/115823/over-50000-tourists-arrive-in-first-eight-days-of-december,ada_derana,general,general_news,Sri Lanka,General news update for public information,info,[],2025-12-10T17:12:38.797746,2025-12-10T17:12:38.798003
1765366958801,"Landslide in Bogahapathana, no injuries or casualties reported","A landslide has been reported in Bogahapathana, Meegahakiula. MORE..",🔴LIVE | Ada Derana Midday Prime News Bulletin,https://www.adaderana.lk/news/115821/landslide-in-bogahapathana-no-injuries-or-casualties-reported,ada_derana,weather,landslides,Sri Lanka,Weather advisory in effect. Minor inconveniences possible.,low,[],2025-12-10T17:12:38.801656,2025-12-10T17:12:38.801895
1765366958805,"Britain sanctions Russian, Chinese entities over disinfo, cyber threats",Britain on Tuesday (Dec 9) sanctioned entities it accused of distorting information in favour of Russia as well as two Chinese companies for alleged cyber activities against the United Kingdom and its allies. MORE..,🔴LIVE | Ada Derana Midday Prime News Bulletin,https://www.adaderana.lk/news/115820/britain-sanctions-russian-chinese-entities-over-disinfo-cyber-threats,ada_derana,general,general_news,Sri Lanka,General news update for public information,info,[],2025-12-10T17:12:38.805338,2025-12-10T17:12:38.805591
1765366958808,Youth succumbs following sudden explosion at fireworks factory in Katana,"A youth has died following a sudden explosion at a fireworks manufacturing factory in Kimbulapitiya, Katana, police stated. MORE..",🔴LIVE | Ada Derana Midday Prime News Bulletin,https://www.adaderana.lk/news/115818/youth-succumbs-following-sudden-explosion-at-fireworks-factory-in-katana,ada_derana,safety,fires,Sri Lanka,Safety advisory issued. Public advised to remain vigilant.,low,[],2025-12-10T17:12:38.808799,2025-12-10T17:12:38.809050
1765366958812,Individual arrested over theft of telecom transmission cables in Rambukkana,"An individual has been arrested in connection with the theft of cables installed on a telecommunication transmission tower located in Yatagama, Rambukkana, police stated. MORE..",🔴LIVE | Ada Derana Midday Prime News Bulletin,https://www.adaderana.lk/news/115817/individual-arrested-over-theft-of-telecom-transmission-cables-in-rambukkana,ada_derana,crime,arrests,Sri Lanka,Minor criminal incident reported. Increased police presence.,low,[],2025-12-10T17:12:38.812876,2025-12-10T17:12:38.813130
1765367774657,Russias first aircraft carrying 35 tons of humanitarian aid arrives in Sri Lanka,Russia has dispatched a consignment of 35 metric tons of humanitarian aid to Sri Lanka following the impact of Cyclone Ditwah. MORE..,🔴LIVE | Ada Derana Midday Prime News Bulletin,https://www.adaderana.lk/news/115838/russias-first-aircraft-carrying-35-tons-of-humanitarian-aid-arrives-in-sri-lanka,ada_derana,weather,cyclones,Sri Lanka,Weather information update for planning purposes.,info,[],2025-12-10T17:26:14.657303,2025-12-10T17:26:14.657574
1765367774660,Australia and UNFPA partner to protect women and girls in cyclone-affected Sri Lanka,"Australia and the United Nations Population Fund (UNFPA) have partnered to deliver urgent humanitarian assistance to protect women and girls across Sri Lanka, affected by catastrophic floods and landslides triggered by Cyclone Ditwah, one of the most devastating climate-related disasters to strike the island nation in recent years. MORE..",🔴LIVE | Ada Derana Midday Prime News Bulletin,https://www.adaderana.lk/news/115837/australia-and-unfpa-partner-to-protect-women-and-girls-in-cyclone-affected-sri-lanka,ada_derana,weather,floods,Sri Lanka,Severe weather conditions posing risks to public safety. Follow official warnings.,high,[],2025-12-10T17:26:14.660295,2025-12-10T17:26:14.660411
1765367774668,Deepavali inscribed on UNESCOs Intangible Cultural Heritage list,"Deepavali  the festival of lights  was on Wednesday (December 10, 2025) inscribed on the UNESCOs Representative List of the Intangible Cultural Heritage of Humanity, sparking celebrations to mark the earning of the coveted tag. MORE..",🔴LIVE | Ada Derana Midday Prime News Bulletin,https://www.adaderana.lk/news/115836/deepavali-inscribed-on-unescos-intangible-cultural-heritage-list,ada_derana,community,community_general,Sri Lanka,General information update for public awareness.,info,[],2025-12-10T17:26:14.668513,2025-12-10T17:26:14.668627
1765367774670,UAE continues to send aid to assist flood-hit Sri Lanka,The UAEs eight humanitarian aid aircraft has arrived in Sri Lanka on Tuesday in efforts to support the country following deadly floods and landslides. MORE..,🔴LIVE | Ada Derana Midday Prime News Bulletin,https://www.adaderana.lk/news/115835/uae-continues-to-send-aid-to-assist-flood-hit-sri-lanka,ada_derana,weather,floods,Sri Lanka,Severe weather conditions posing risks to public safety. Follow official warnings.,high,[],2025-12-10T17:26:14.670056,2025-12-10T17:26:14.670160
1765367774675,Advisory issued for severe lightning,An Amber advisory has been issued by the Department of Meteorology for severe lightning in the Western and Sabaragamuwa provinces and in Galle and Matara Districts. MORE..,🔴LIVE | Ada Derana Midday Prime News Bulletin,https://www.adaderana.lk/news/115834/advisory-issued-for-severe-lightning,ada_derana,general,general_news,Sri Lanka,General news update for public information,info,[],2025-12-10T17:26:14.675259,2025-12-10T17:26:14.675521
1765367774677,"Significant flooding reported after heavy rainfall in Jeddah, Saudi Arabia","Jeddah, Saudi Arabia has experienced heavy rainfall that has led to significant flooding and traffic congestion across the city. MORE..",🔴LIVE | Ada Derana Midday Prime News Bulletin,https://www.adaderana.lk/news/115833/significant-flooding-reported-after-heavy-rainfall-in-jeddah-saudi-arabia,ada_derana,weather,rainfall_alerts,Sri Lanka,Weather-related disruptions expected. Stay informed about updates.,medium,[],2025-12-10T17:26:14.677879,2025-12-10T17:26:14.677992
1765367774682,Ex-Central Bank Governor Ajith Nivard Cabraal and three others acquitted in Greek Bond case,Former Central Bank Governor Ajith Nivard Cabraal has been released from the case pertaining to the 2012 purchase of Greek Bonds. MORE..,🔴LIVE | Ada Derana Midday Prime News Bulletin,https://www.adaderana.lk/news/115832/ex-central-bank-governor-ajith-nivard-cabraal-and-three-others-acquitted-in-greek-bond-case,ada_derana,general,general_news,Sri Lanka,General news update for public information,info,[],2025-12-10T17:26:14.682398,2025-12-10T17:26:14.682510
1765367774684,Case against Yoshitha and grandmother adjourned pending Daisy Forrests medical report,"The Attorney General informed the Colombo High Court today (10) that Daisy Forrest, the grandmother of Yoshitha Rajapaksa and a defendant in a case filed under the Prevention of Money Laundering Act, is scheduled to undergo a psychiatric medical report tomorrow by the Colombo Judicial Medical Officer. MORE..",🔴LIVE | Ada Derana Midday Prime News Bulletin,https://www.adaderana.lk/news/115831/case-against-yoshitha-and-grandmother-adjourned-pending-daisy-forrests-medical-report,ada_derana,crime,court_legal_updates,Colombo,Law enforcement update for public information.,info,[],2025-12-10T17:26:14.684075,2025-12-10T17:26:14.684179
1765367774686,Homeowners in landslide-prone areas provided with reports on risk level: NBRO,The National Building Research Organisation (NBRO) has extended landslide warnings issued to several areas based on current ground conditions and weather forecasts. MORE..,🔴LIVE | Ada Derana Midday Prime News Bulletin,https://www.adaderana.lk/news/115830/homeowners-in-landslide-prone-areas-provided-with-reports-on-risk-level-nbro-,ada_derana,weather,landslides,Sri Lanka,Weather-related disruptions expected. Stay informed about updates.,medium,[],2025-12-10T17:26:14.686837,2025-12-10T17:26:14.686983
1765367774691,Heavy vehicles barred from using road over Kotmale Dam: Mahaweli Authority,"Heavy vehicles have been barred from using the road over the Kotmale Dam, the Mahaweli Development Authority (MDA) has announced. MORE..",🔴LIVE | Ada Derana Midday Prime News Bulletin,https://www.adaderana.lk/news/115829/heavy-vehicles-barred-from-using-road-over-kotmale-dam-mahaweli-authority,ada_derana,traffic,road_accident,Sri Lanka,Traffic information update for public awareness.,info,[],2025-12-10T17:26:14.691108,2025-12-10T17:26:14.691325
