id,title,summary,full_text,link,source,category,subcategory,location,impact,severity,keywords,timestamp,processed_at
1765373139211,Kolonna Pradeshiya Sabhas budget defeated for the second time,"The annual budget of the Kolonna Pradeshiya Sabha, which is controlled by the National Peoples Power (NPP), has been defeated for the second time. MORE..",LIVE🔴Ada Derana Prime Time News Bulletin 6.55 pm,https://www.adaderana.lk/news/115828/kolonna-pradeshiya-sabhas-budget-defeated-for-the-second-time,ada_derana,general,general_news,Sri Lanka,General news update for public information,info,[],2025-12-10T18:55:39.211274,2025-12-10T18:55:39.211675
1765373139219,Family dog assists in locating bodies of seven victims in Ambokka landslide,"Highlands surrounding the Ambokka village within the Pallepola Divisional Secretariat area in Matale, have reportedly become increasingly unstable following recent heavy rains. MORE..",LIVE🔴Ada Derana Prime Time News Bulletin 6.55 pm,https://www.adaderana.lk/news/115827/family-dog-assists-in-locating-bodies-of-seven-victims-in-ambokka-landslide,ada_derana,weather,rainfall_alerts,Sri Lanka,Weather advisory in effect. Minor inconveniences possible.,low,[],2025-12-10T18:55:39.219650,2025-12-10T18:55:39.220085
1765373139223,H-1B visa appointments postponed for many Indians amid US Social Media rules,The US State Departments new social media vetting policy has triggered massive disruptions for H-1B visa applicants in India as many appointments have been postponed to next year. The US Embassy in India issued an advisory to the visa applicants on Tuesday night. MORE..,LIVE🔴Ada Derana Prime Time News Bulletin 6.55 pm,https://www.adaderana.lk/news/115826/h-1b-visa-appointments-postponed-for-many-indians-amid-us-social-media-rules,ada_derana,government,government_general,Sri Lanka,Policy changes announced. Impact on services expected.,medium,[],2025-12-10T18:55:39.223614,2025-12-10T18:55:39.223940
1765373139239,Google Maps begins updating Sri Lankas road network  Minister,"Google Maps has commenced updating information pertaining Sri Lankas road network covering around 12,000 kilometers, Minister of Transport Bimal Ratnayake has stated. MORE..",LIVE🔴Ada Derana Prime Time News Bulletin 6.55 pm,https://www.adaderana.lk/news/115825/google-maps-begins-updating-sri-lankas-road-network-minister,ada_derana,traffic,bus_issues,Sri Lanka,Traffic information update for public awareness.,info,[],2025-12-10T18:55:39.239043,2025-12-10T18:55:39.239491
1765373139244,"Rebuilding Sri Lanka Fund receives Rs. 1,893 million thus far","The Rebuilding Sri Lanka programme, initiated to restore the country following the damage caused by Cyclone Ditwah, has received a total of Rs. 1,893 million in funding from domestic sources, overseas Sri Lankans, and various institutions, the Secretary to the Ministry of Finance, Dr. Harshana Suriyapperuma has stated. MORE..",LIVE🔴Ada Derana Prime Time News Bulletin 6.55 pm,https://www.adaderana.lk/news/115824/rebuilding-sri-lanka-fund-receives-rs-1893-million-thus-far,ada_derana,weather,cyclones,Sri Lanka,Weather advisory in effect. Minor inconveniences possible.,low,[],2025-12-10T18:55:39.243923,2025-12-10T18:55:39.244249
1765373139249,"Over 50,000 tourists arrive in first eight days of December","A total of 50,222 tourists have arrived in the country thus far in December, data from the Sri Lanka Tourism Development Authority (SLTDA) shows. MORE..",LIVE🔴Ada Derana Prime Time News Bulletin 6.55 pm,https://www.adaderana.lk/news/115823/over-50000-tourists-arrive-in-first-eight-days-of-december,ada_derana,general,general_news,Sri Lanka,General news update for public information,info,[],2025-12-10T18:55:39.248905,2025-12-10T18:55:39.249265
1765373139253,"Landslide in Bogahapathana, no injuries or casualties reported","A landslide has been reported in Bogahapathana, Meegahakiula. MORE..",LIVE🔴Ada Derana Prime Time News Bulletin 6.55 pm,https://www.adaderana.lk/news/115821/landslide-in-bogahapathana-no-injuries-or-casualties-reported,ada_derana,weather,landslides,Sri Lanka,Weather advisory in effect. Minor inconveniences possible.,low,[],2025-12-10T18:55:39.253706,2025-12-10T18:55:39.253935
1765373139255,"Britain sanctions Russian, Chinese entities over disinfo, cyber threats",Britain on Tuesday (Dec 9) sanctioned entities it accused of distorting information in favour of Russia as well as two Chinese companies for alleged cyber activities against the United Kingdom and its allies. MORE..,LIVE🔴Ada Derana Prime Time News Bulletin 6.55 pm,https://www.adaderana.lk/news/115820/britain-sanctions-russian-chinese-entities-over-disinfo-cyber-threats,ada_derana,general,general_news,Sri Lanka,General news update for public information,info,[],2025-12-10T18:55:39.255878,2025-12-10T18:55:39.255982
1765373139258,Youth succumbs following sudden explosion at fireworks factory in Katana,"A youth has died following a sudden explosion at a fireworks manufacturing factory in Kimbulapitiya, Katana, police stated. MORE..",LIVE🔴Ada Derana Prime Time News Bulletin 6.55 pm,https://www.adaderana.lk/news/115818/youth-succumbs-following-sudden-explosion-at-fireworks-factory-in-katana,ada_derana,safety,fires,Sri Lanka,Safety advisory issued. Public advised to remain vigilant.,low,[],2025-12-10T18:55:39.258585,2025-12-10T18:55:39.258753
1765373399718,Amended timetable of 2025 A/L examination released,"The Ministry of Education has decided that the subjects of the 2025 G.C.E. Advanced Level (A/L) examination which were postponed due to the adverse weather conditions in Sri Lanka will now be conducted from January 12 to January 20, 2026. MORE..",LIVE🔴Ada Derana Prime Time News Bulletin 6.55 pm,https://www.adaderana.lk/news/115840/amended-timetable-of-2025-al-examination-released,ada_derana,weather,weather_general,Sri Lanka,Weather information update for planning purposes.,info,[],2025-12-10T18:59:59.718258,2025-12-10T18:59:59.718340
1765373399720,Notice on reopening preschools and early childhood development centers,All preschools and early childhood development centers that were closed due to the emergency disaster situation and are now deemed safe to resume operations will be reopened from 16 December 2025. MORE..,LIVE🔴Ada Derana Prime Time News Bulletin 6.55 pm,https://www.adaderana.lk/news/115839/notice-on-reopening-preschools-and-early-childhood-development-centers-,ada_derana,safety,rescue_operations,Sri Lanka,Emergency safety situation requiring immediate attention and precautions.,high,[],2025-12-10T18:59:59.720395,2025-12-10T18:59:59.720457
1765373399721,Russias first aircraft carrying 35 tons of humanitarian aid arrives in Sri Lanka,Russia has dispatched a consignment of 35 metric tons of humanitarian aid to Sri Lanka following the impact of Cyclone Ditwah. MORE..,LIVE🔴Ada Derana Prime Time News Bulletin 6.55 pm,https://www.adaderana.lk/news/115838/russias-first-aircraft-carrying-35-tons-of-humanitarian-aid-arrives-in-sri-lanka,ada_derana,weather,cyclones,Sri Lanka,Weather information update for planning purposes.,info,[],2025-12-10T18:59:59.721891,2025-12-10T18:59:59.722000
1765373399724,Australia and UNFPA partner to protect women and girls in cyclone-affected Sri Lanka,"Australia and the United Nations Population Fund (UNFPA) have partnered to deliver urgent humanitarian assistance to protect women and girls across Sri Lanka, affected by catastrophic floods and landslides triggered by Cyclone Ditwah, one of the most devastating climate-related disasters to strike the island nation in recent years. MORE..",LIVE🔴Ada Derana Prime Time News Bulletin 6.55 pm,https://www.adaderana.lk/news/115837/australia-and-unfpa-partner-to-protect-women-and-girls-in-cyclone-affected-sri-lanka,ada_derana,weather,floods,Sri Lanka,Severe weather conditions posing risks to public safety. Follow official warnings.,high,[],2025-12-10T18:59:59.724546,2025-12-10T18:59:59.724649
1765373399727,Deepavali inscribed on UNESCOs Intangible Cultural Heritage list,"Deepavali  the festival of lights  was on Wednesday (December 10, 2025) inscribed on the UNESCOs Representative List of the Intangible Cultural Heritage of Humanity, sparking celebrations to mark the earning of the coveted tag. MORE..",LIVE🔴Ada Derana Prime Time News Bulletin 6.55 pm,https://www.adaderana.lk/news/115836/deepavali-inscribed-on-unescos-intangible-cultural-heritage-list,ada_derana,community,community_general,Sri Lanka,General information update for public awareness.,info,[],2025-12-10T18:59:59.727386,2025-12-10T18:59:59.727446
1765373399728,UAE continues to send aid to assist flood-hit Sri Lanka,The UAEs eight humanitarian aid aircraft has arrived in Sri Lanka on Tuesday in efforts to support the country following deadly floods and landslides. MORE..,LIVE🔴Ada Derana Prime Time News Bulletin 6.55 pm,https://www.adaderana.lk/news/115835/uae-continues-to-send-aid-to-assist-flood-hit-sri-lanka,ada_derana,weather,floods,Sri Lanka,Severe weather conditions posing risks to public safety. Follow official warnings.,high,[],2025-12-10T18:59:59.728233,2025-12-10T18:59:59.728281
1765373399729,Advisory issued for severe lightning,An Amber advisory has been issued by the Department of Meteorology for severe lightning in the Western and Sabaragamuwa provinces and in Galle and Matara Districts. MORE..,LIVE🔴Ada Derana Prime Time News Bulletin 6.55 pm,https://www.adaderana.lk/news/115834/advisory-issued-for-severe-lightning,ada_derana,general,general_news,Sri Lanka,General news update for public information,info,[],2025-12-10T18:59:59.729449,2025-12-10T18:59:59.729494
1765373399730,"Significant flooding reported after heavy rainfall in Jeddah, Saudi Arabia","Jeddah, Saudi Arabia has experienced heavy rainfall that has led to significant flooding and traffic congestion across the city. MORE..",LIVE🔴Ada Derana Prime Time News Bulletin 6.55 pm,https://www.adaderana.lk/news/115833/significant-flooding-reported-after-heavy-rainfall-in-jeddah-saudi-arabia,ada_derana,weather,rainfall_alerts,Sri Lanka,Weather-related disruptions expected. Stay informed about updates.,medium,[],2025-12-10T18:59:59.729982,2025-12-10T18:59:59.730023
1765373399734,Greek Bond case: Ex-CBSL Governor Cabraal released,"Former Central Bank Governor Ajith Nivard Cabraal has been released from the case pertaining to the 2012 purchase of Greek Bonds, subject to conditions, Ada Derana reporter said. MORE..",LIVE🔴Ada Derana Prime Time News Bulletin 6.55 pm,https://www.adaderana.lk/news/115832/greek-bond-case-ex-cbsl-governor-cabraal-released,ada_derana,general,general_news,Sri Lanka,General news update for public information,info,[],2025-12-10T18:59:59.733956,2025-12-10T18:59:59.734091
1765373399735,Case against Yoshitha and grandmother adjourned pending Daisy Forrests medical report,"The Attorney General informed the Colombo High Court today (10) that Daisy Forrest, the grandmother of Yoshitha Rajapaksa and a defendant in a case filed under the Prevention of Money Laundering Act, is scheduled to undergo a psychiatric medical report tomorrow by the Colombo Judicial Medical Officer. MORE..",LIVE🔴Ada Derana Prime Time News Bulletin 6.55 pm,https://www.adaderana.lk/news/115831/case-against-yoshitha-and-grandmother-adjourned-pending-daisy-forrests-medical-report,ada_derana,crime,court_legal_updates,Colombo,Law enforcement update for public information.,info,[],2025-12-10T18:59:59.735581,2025-12-10T18:59:59.735709
1765373399738,Homeowners in landslide-prone areas provided with reports on risk level: NBRO,The National Building Research Organisation (NBRO) has extended landslide warnings issued to several areas based on current ground conditions and weather forecasts. MORE..,LIVE🔴Ada Derana Prime Time News Bulletin 6.55 pm,https://www.adaderana.lk/news/115830/homeowners-in-landslide-prone-areas-provided-with-reports-on-risk-level-nbro-,ada_derana,weather,landslides,Sri Lanka,Weather-related disruptions expected. Stay informed about updates.,medium,[],2025-12-10T18:59:59.738217,2025-12-10T18:59:59.738366
1765373399740,Heavy vehicles barred from using road over Kotmale Dam: Mahaweli Authority,"Heavy vehicles have been barred from using the road over the Kotmale Dam, the Mahaweli Development Authority (MDA) has announced. MORE..",LIVE🔴Ada Derana Prime Time News Bulletin 6.55 pm,https://www.adaderana.lk/news/115829/heavy-vehicles-barred-from-using-road-over-kotmale-dam-mahaweli-authority,ada_derana,traffic,road_accident,Sri Lanka,Traffic information update for public awareness.,info,[],2025-12-10T18:59:59.740775,2025-12-10T18:59:59.740826
1765373399742,Kolonna Pradeshiya Sabhas budget defeated for the second time,"The annual budget of the Kolonna Pradeshiya Sabha, which is controlled by the National Peoples Power (NPP), has been defeated for the second time. MORE..",LIVE🔴Ada Derana Prime Time News Bulletin 6.55 pm,https://www.adaderana.lk/news/115828/kolonna-pradeshiya-sabhas-budget-defeated-for-the-second-time,ada_derana,general,general_news,Sri Lanka,General news update for public information,info,[],2025-12-10T18:59:59.741940,2025-12-10T18:59:59.742107
1765373399744,Family dog assists in locating bodies of seven victims in Ambokka landslide,"Highlands surrounding the Ambokka village within the Pallepola Divisional Secretariat area in Matale, have reportedly become increasingly unstable following recent heavy rains. MORE..",LIVE🔴Ada Derana Prime Time News Bulletin 6.55 pm,https://www.adaderana.lk/news/115827/family-dog-assists-in-locating-bodies-of-seven-victims-in-ambokka-landslide,ada_derana,weather,rainfall_alerts,Sri Lanka,Weather advisory in effect. Minor inconveniences possible.,low,[],2025-12-10T18:59:59.744301,2025-12-10T18:59:59.744345
1765373399744,H-1B visa appointments postponed for many Indians amid US Social Media rules,The US State Departments new social media vetting policy has triggered massive disruptions for H-1B visa applicants in India as many appointments have been postponed to next year. The US Embassy in India issued an advisory to the visa applicants on Tuesday night. MORE..,LIVE🔴Ada Derana Prime Time News Bulletin 6.55 pm,https://www.adaderana.lk/news/115826/h-1b-visa-appointments-postponed-for-many-indians-amid-us-social-media-rules,ada_derana,government,government_general,Sri Lanka,Policy changes announced. Impact on services expected.,medium,[],2025-12-10T18:59:59.744909,2025-12-10T18:59:59.744951
1765373399745,Google Maps begins updating Sri Lankas road network  Minister,"Google Maps has commenced updating information pertaining Sri Lankas road network covering around 12,000 kilometers, Minister of Transport Bimal Ratnayake has stated. MORE..",LIVE🔴Ada Derana Prime Time News Bulletin 6.55 pm,https://www.adaderana.lk/news/115825/google-maps-begins-updating-sri-lankas-road-network-minister,ada_derana,traffic,bus_issues,Sri Lanka,Traffic information update for public awareness.,info,[],2025-12-10T18:59:59.745886,2025-12-10T18:59:59.745926
1765373399747,"Rebuilding Sri Lanka Fund receives Rs. 1,893 million thus far","The Rebuilding Sri Lanka programme, initiated to restore the country following the damage caused by Cyclone Ditwah, has received a total of Rs. 1,893 million in funding from domestic sources, overseas Sri Lankans, and various institutions, the Secretary to the Ministry of Finance, Dr. Harshana Suriyapperuma has stated. MORE..",LIVE🔴Ada Derana Prime Time News Bulletin 6.55 pm,https://www.adaderana.lk/news/115824/rebuilding-sri-lanka-fund-receives-rs-1893-million-thus-far,ada_derana,weather,cyclones,Sri Lanka,Weather advisory in effect. Minor inconveniences possible.,low,[],2025-12-10T18:59:59.747601,2025-12-10T18:59:59.747742
1765373399749,"Over 50,000 tourists arrive in first eight days of December","A total of 50,222 tourists have arrived in the country thus far in December, data from the Sri Lanka Tourism Development Authority (SLTDA) shows. MORE..",LIVE🔴Ada Derana Prime Time News Bulletin 6.55 pm,https://www.adaderana.lk/news/115823/over-50000-tourists-arrive-in-first-eight-days-of-december,ada_derana,general,general_news,Sri Lanka,General news update for public information,info,[],2025-12-10T18:59:59.749308,2025-12-10T18:59:59.749475
1765373399750,"Landslide in Bogahapathana, no injuries or casualties reported","A landslide has been reported in Bogahapathana, Meegahakiula. MORE..",LIVE🔴Ada Derana Prime Time News Bulletin 6.55 pm,https://www.adaderana.lk/news/115821/landslide-in-bogahapathana-no-injuries-or-casualties-reported,ada_derana,weather,landslides,Sri Lanka,Weather advisory in effect. Minor inconveniences possible.,low,[],2025-12-10T18:59:59.750926,2025-12-10T18:59:59.751026
1765373399752,"Britain sanctions Russian, Chinese entities over disinfo, cyber threats",Britain on Tuesday (Dec 9) sanctioned entities it accused of distorting information in favour of Russia as well as two Chinese companies for alleged cyber activities against the United Kingdom and its allies. MORE..,LIVE🔴Ada Derana Prime Time News Bulletin 6.55 pm,https://www.adaderana.lk/news/115820/britain-sanctions-russian-chinese-entities-over-disinfo-cyber-threats,ada_derana,general,general_news,Sri Lanka,General news update for public information,info,[],2025-12-10T18:59:59.752346,2025-12-10T18:59:59.752479
1765373724725,Amended timetable of 2025 A/L examination released,"The Ministry of Education has decided that the subjects of the 2025 G.C.E. Advanced Level (A/L) examination which were postponed due to the adverse weather conditions in Sri Lanka will now be conducted from January 12 to January 20, 2026. MORE..",LIVE🔴Ada Derana Prime Time News Bulletin 6.55 pm,https://www.adaderana.lk/news/115840/amended-timetable-of-2025-al-examination-released,ada_derana,weather,weather_general,Sri Lanka,Weather information update for planning purposes.,info,[],2025-12-10T19:05:24.725787,2025-12-10T19:05:24.726057
1765373724728,Notice on reopening preschools and early childhood development centers,All preschools and early childhood development centers that were closed due to the emergency disaster situation and are now deemed safe to resume operations will be reopened from 16 December 2025. MORE..,LIVE🔴Ada Derana Prime Time News Bulletin 6.55 pm,https://www.adaderana.lk/news/115839/notice-on-reopening-preschools-and-early-childhood-development-centers-,ada_derana,safety,rescue_operations,Sri Lanka,Emergency safety situation requiring immediate attention and precautions.,high,[],2025-12-10T19:05:24.728332,2025-12-10T19:05:24.728386
1765373724734,Russias first aircraft carrying 35 tons of humanitarian aid arrives in Sri Lanka,Russia has dispatched a consignment of 35 metric tons of humanitarian aid to Sri Lanka following the impact of Cyclone Ditwah. MORE..,LIVE🔴Ada Derana Prime Time News Bulletin 6.55 pm,https://www.adaderana.lk/news/115838/russias-first-aircraft-carrying-35-tons-of-humanitarian-aid-arrives-in-sri-lanka,ada_derana,weather,cyclones,Sri Lanka,Weather information update for planning purposes.,info,[],2025-12-10T19:05:24.734610,2025-12-10T19:05:24.734724
1765373724743,Australia and UNFPA partner to protect women and girls in cyclone-affected Sri Lanka,"Australia and the United Nations Population Fund (UNFPA) have partnered to deliver urgent humanitarian assistance to protect women and girls across Sri Lanka, affected by catastrophic floods and landslides triggered by Cyclone Ditwah, one of the most devastating climate-related disasters to strike the island nation in recent years. MORE..",LIVE🔴Ada Derana Prime Time News Bulletin 6.55 pm,https://www.adaderana.lk/news/115837/australia-and-unfpa-partner-to-protect-women-and-girls-in-cyclone-affected-sri-lanka,ada_derana,weather,floods,Sri Lanka,Severe weather conditions posing risks to public safety. Follow official warnings.,high,[],2025-12-10T19:05:24.743882,2025-12-10T19:05:24.744001
1765373724747,Deepavali inscribed on UNESCOs Intangible Cultural Heritage list,"Deepavali  the festival of lights  was on Wednesday (December 10, 2025) inscribed on the UNESCOs Representative List of the Intangible Cultural Heritage of Humanity, sparking celebrations to mark the earning of the coveted tag. MORE..",LIVE🔴Ada Derana Prime Time News Bulletin 6.55 pm,https://www.adaderana.lk/news/115836/deepavali-inscribed-on-unescos-intangible-cultural-heritage-list,ada_derana,community,community_general,Sri Lanka,General information update for public awareness.,info,[],2025-12-10T19:05:24.747544,2025-12-10T19:05:24.747644
1765373724749,UAE continues to send aid to assist flood-hit Sri Lanka,The UAEs eight humanitarian aid aircraft has arrived in Sri Lanka on Tuesday in efforts to support the country following deadly floods and landslides. MORE..,LIVE🔴Ada Derana Prime Time News Bulletin 6.55 pm,https://www.adaderana.lk/news/115835/uae-continues-to-send-aid-to-assist-flood-hit-sri-lanka,ada_derana,weather,floods,Sri Lanka,Severe weather conditions posing risks to public safety. Follow official warnings.,high,[],2025-12-10T19:05:24.749285,2025-12-10T19:05:24.749428
1765373724753,Advisory issued for severe lightning,An Amber advisory has been issued by the Department of Meteorology for severe lightning in the Western and Sabaragamuwa provinces and in Galle and Matara Districts. MORE..,LIVE🔴Ada Derana Prime Time News Bulletin 6.55 pm,https://www.adaderana.lk/news/115834/advisory-issued-for-severe-lightning,ada_derana,general,general_news,Sri Lanka,General news update for public information,info,[],2025-12-10T19:05:24.753363,2025-12-10T19:05:24.753471
1765373724755,"Significant flooding reported after heavy rainfall in Jeddah, Saudi Arabia","Jeddah, Saudi Arabia has experienced heavy rainfall that has led to significant flooding and traffic congestion across the city. MORE..",LIVE🔴Ada Derana Prime Time News Bulletin 6.55 pm,https://www.adaderana.lk/news/115833/significant-flooding-reported-after-heavy-rainfall-in-jeddah-saudi-arabia,ada_derana,weather,rainfall_alerts,Sri Lanka,Weather-related disruptions expected. Stay informed about updates.,medium,[],2025-12-10T19:05:24.755319,2025-12-10T19:05:24.755445
1765373724761,Greek Bond case: Ex-CBSL Governor Cabraal released,"Former Central Bank Governor Ajith Nivard Cabraal has been released from the case pertaining to the 2012 purchase of Greek Bonds, subject to conditions, Ada Derana reporter said. MORE..",LIVE🔴Ada Derana Prime Time News Bulletin 6.55 pm,https://www.adaderana.lk/news/115832/greek-bond-case-ex-cbsl-governor-cabraal-released,ada_derana,general,general_news,Sri Lanka,General news update for public information,info,[],2025-12-10T19:05:24.760118,2025-12-10T19:05:24.761830
1765373724765,Case against Yoshitha and grandmother adjourned pending Daisy Forrests medical report,"The Attorney General informed the Colombo High Court today (10) that Daisy Forrest, the grandmother of Yoshitha Rajapaksa and a defendant in a case filed under the Prevention of Money Laundering Act, is scheduled to undergo a psychiatric medical report tomorrow by the Colombo Judicial Medical Officer. MORE..",LIVE🔴Ada Derana Prime Time News Bulletin 6.55 pm,https://www.adaderana.lk/news/115831/case-against-yoshitha-and-grandmother-adjourned-pending-daisy-forrests-medical-report,ada_derana,crime,court_legal_updates,Colombo,Law enforcement update for public information.,info,[],2025-12-10T19:05:24.765739,2025-12-10T19:05:24.766089
1765373724769,Homeowners in landslide-prone areas provided with reports on risk level: NBRO,The National Building Research Organisation (NBRO) has extended landslide warnings issued to several areas based on current ground conditions and weather forecasts. MORE..,LIVE🔴Ada Derana Prime Time News Bulletin 6.55 pm,https://www.adaderana.lk/news/115830/homeowners-in-landslide-prone-areas-provided-with-reports-on-risk-level-nbro-,ada_derana,weather,landslides,Sri Lanka,Weather-related disruptions expected. Stay informed about updates.,medium,[],2025-12-10T19:05:24.769280,2025-12-10T19:05:24.769367
1765373724775,Heavy vehicles barred from using road over Kotmale Dam: Mahaweli Authority,"Heavy vehicles have been barred from using the road over the Kotmale Dam, the Mahaweli Development Authority (MDA) has announced. MORE..",LIVE🔴Ada Derana Prime Time News Bulletin 6.55 pm,https://www.adaderana.lk/news/115829/heavy-vehicles-barred-from-using-road-over-kotmale-dam-mahaweli-authority,ada_derana,traffic,road_accident,Sri Lanka,Traffic information update for public awareness.,info,[],2025-12-10T19:05:24.774917,2025-12-10T19:05:24.775178
1765373724779,Kolonna Pradeshiya Sabhas budget defeated for the second time,"The annual budget of the Kolonna Pradeshiya Sabha, which is controlled by the National Peoples Power (NPP), has been defeated for the second time. MORE..",LIVE🔴Ada Derana Prime Time News Bulletin 6.55 pm,https://www.adaderana.lk/news/115828/kolonna-pradeshiya-sabhas-budget-defeated-for-the-second-time,ada_derana,general,general_news,Sri Lanka,General news update for public information,info,[],2025-12-10T19:05:24.778790,2025-12-10T19:05:24.779318
1765373724783,Family dog assists in locating bodies of seven victims in Ambokka landslide,"Highlands surrounding the Ambokka village within the Pallepola Divisional Secretariat area in Matale, have reportedly become increasingly unstable following recent heavy rains. MORE..",LIVE🔴Ada Derana Prime Time News Bulletin 6.55 pm,https://www.adaderana.lk/news/115827/family-dog-assists-in-locating-bodies-of-seven-victims-in-ambokka-landslide,ada_derana,weather,rainfall_alerts,Sri Lanka,Weather advisory in effect. Minor inconveniences possible.,low,[],2025-12-10T19:05:24.783498,2025-12-10T19:05:24.783732
