id,title,summary,full_text,link,source,category,subcategory,location,impact,severity,keywords,timestamp,processed_at
1765377385249,Google Maps begins updating Sri Lankas road network  Minister,"Google Maps has commenced updating information pertaining Sri Lankas road network covering around 12,000 kilometers, Minister of Transport Bimal Ratnayake has stated. MORE..",LIVE🔴Ada Derana Prime Time News Bulletin 6.55 pm,https://www.adaderana.lk/news/115825/google-maps-begins-updating-sri-lankas-road-network-minister,ada_derana,traffic,bus_issues,Sri Lanka,Traffic information update for public awareness.,info,[],2025-12-10T20:06:25.249223,2025-12-10T20:06:25.249327
1765377385251,"Rebuilding Sri Lanka Fund receives Rs. 1,893 million thus far","The Rebuilding Sri Lanka programme, initiated to restore the country following the damage caused by Cyclone Ditwah, has received a total of Rs. 1,893 million in funding from domestic sources, overseas Sri Lankans, and various institutions, the Secretary to the Ministry of Finance, Dr. Harshana Suriyapperuma has stated. MORE..",LIVE🔴Ada Derana Prime Time News Bulletin 6.55 pm,https://www.adaderana.lk/news/115824/rebuilding-sri-lanka-fund-receives-rs-1893-million-thus-far,ada_derana,weather,cyclones,Sri Lanka,Weather advisory in effect. Minor inconveniences possible.,low,[],2025-12-10T20:06:25.251235,2025-12-10T20:06:25.251347
1765377385253,"Over 50,000 tourists arrive in first eight days of December","A total of 50,222 tourists have arrived in the country thus far in December, data from the Sri Lanka Tourism Development Authority (SLTDA) shows. MORE..",LIVE🔴Ada Derana Prime Time News Bulletin 6.55 pm,https://www.adaderana.lk/news/115823/over-50000-tourists-arrive-in-first-eight-days-of-december,ada_derana,general,general_news,Sri Lanka,General news update for public information,info,[],2025-12-10T20:06:25.253173,2025-12-10T20:06:25.253280
1765377385255,"Landslide in Bogahapathana, no injuries or casualties reported","A landslide has been reported in Bogahapathana, Meegahakiula. MORE..",LIVE🔴Ada Derana Prime Time News Bulletin 6.55 pm,https://www.adaderana.lk/news/115821/landslide-in-bogahapathana-no-injuries-or-casualties-reported,ada_derana,weather,landslides,Sri Lanka,Weather advisory in effect. Minor inconveniences possible.,low,[],2025-12-10T20:06:25.255142,2025-12-10T20:06:25.255244
1765378267706,Thriposha company hands over Rs. 100 mln in dividends to Treasury,Sri Lanka Thriposha Limited has General Treasury handed over a sum of Rs. 100 million to the General Treasury as dividends. MORE..,LIVE🔴Ada Derana Prime Time News Bulletin 6.55 pm,https://www.adaderana.lk/news/115841/thriposha-company-hands-over-rs-100-mln-in-dividends-to-treasury,ada_derana,general,general_news,Sri Lanka,General news update for public information,info,[],2025-12-10T20:21:07.706482,2025-12-10T20:21:07.706564
1765378267708,Amended timetable of 2025 A/L examination released,"The Ministry of Education has decided that the subjects of the 2025 G.C.E. Advanced Level (A/L) examination which were postponed due to the adverse weather conditions in Sri Lanka will now be conducted from January 12 to January 20, 2026. MORE..",LIVE🔴Ada Derana Prime Time News Bulletin 6.55 pm,https://www.adaderana.lk/news/115840/amended-timetable-of-2025-al-examination-released,ada_derana,weather,weather_general,Sri Lanka,Weather information update for planning purposes.,info,[],2025-12-10T20:21:07.708769,2025-12-10T20:21:07.708832
1765378267711,Notice on reopening preschools and early childhood development centers,All preschools and early childhood development centers that were closed due to the emergency disaster situation and are now deemed safe to resume operations will be reopened from 16 December 2025. MORE..,LIVE🔴Ada Derana Prime Time News Bulletin 6.55 pm,https://www.adaderana.lk/news/115839/notice-on-reopening-preschools-and-early-childhood-development-centers-,ada_derana,safety,rescue_operations,Sri Lanka,Emergency safety situation requiring immediate attention and precautions.,high,[],2025-12-10T20:21:07.711457,2025-12-10T20:21:07.711518
1765378267713,Russias first aircraft carrying 35 tons of humanitarian aid arrives in Sri Lanka,Russia has dispatched a consignment of 35 metric tons of humanitarian aid to Sri Lanka following the impact of Cyclone Ditwah. MORE..,LIVE🔴Ada Derana Prime Time News Bulletin 6.55 pm,https://www.adaderana.lk/news/115838/russias-first-aircraft-carrying-35-tons-of-humanitarian-aid-arrives-in-sri-lanka,ada_derana,weather,cyclones,Sri Lanka,Weather information update for planning purposes.,info,[],2025-12-10T20:21:07.713581,2025-12-10T20:21:07.713634
1765378267715,Australia and UNFPA partner to protect women and girls in cyclone-affected Sri Lanka,"Australia and the United Nations Population Fund (UNFPA) have partnered to deliver urgent humanitarian assistance to protect women and girls across Sri Lanka, affected by catastrophic floods and landslides triggered by Cyclone Ditwah, one of the most devastating climate-related disasters to strike the island nation in recent years. MORE..",LIVE🔴Ada Derana Prime Time News Bulletin 6.55 pm,https://www.adaderana.lk/news/115837/australia-and-unfpa-partner-to-protect-women-and-girls-in-cyclone-affected-sri-lanka,ada_derana,weather,floods,Sri Lanka,Severe weather conditions posing risks to public safety. Follow official warnings.,high,[],2025-12-10T20:21:07.715073,2025-12-10T20:21:07.715128
1765378267717,Deepavali inscribed on UNESCOs Intangible Cultural Heritage list,"Deepavali  the festival of lights  was on Wednesday (December 10, 2025) inscribed on the UNESCOs Representative List of the Intangible Cultural Heritage of Humanity, sparking celebrations to mark the earning of the coveted tag. MORE..",LIVE🔴Ada Derana Prime Time News Bulletin 6.55 pm,https://www.adaderana.lk/news/115836/deepavali-inscribed-on-unescos-intangible-cultural-heritage-list,ada_derana,community,community_general,Sri Lanka,General information update for public awareness.,info,[],2025-12-10T20:21:07.717474,2025-12-10T20:21:07.717526
1765378267718,UAE continues to send aid to assist flood-hit Sri Lanka,The UAEs eight humanitarian aid aircraft has arrived in Sri Lanka on Tuesday in efforts to support the country following deadly floods and landslides. MORE..,LIVE🔴Ada Derana Prime Time News Bulletin 6.55 pm,https://www.adaderana.lk/news/115835/uae-continues-to-send-aid-to-assist-flood-hit-sri-lanka,ada_derana,weather,floods,Sri Lanka,Severe weather conditions posing risks to public safety. Follow official warnings.,high,[],2025-12-10T20:21:07.718124,2025-12-10T20:21:07.718169
1765378267721,Advisory issued for severe lightning,An Amber advisory has been issued by the Department of Meteorology for severe lightning in the Western and Sabaragamuwa provinces and in Galle and Matara Districts. MORE..,LIVE🔴Ada Derana Prime Time News Bulletin 6.55 pm,https://www.adaderana.lk/news/115834/advisory-issued-for-severe-lightning,ada_derana,general,general_news,Sri Lanka,General news update for public information,info,[],2025-12-10T20:21:07.721010,2025-12-10T20:21:07.721064
1765378267721,"Significant flooding reported after heavy rainfall in Jeddah, Saudi Arabia","Jeddah, Saudi Arabia has experienced heavy rainfall that has led to significant flooding and traffic congestion across the city. MORE..",LIVE🔴Ada Derana Prime Time News Bulletin 6.55 pm,https://www.adaderana.lk/news/115833/significant-flooding-reported-after-heavy-rainfall-in-jeddah-saudi-arabia,ada_derana,weather,rainfall_alerts,Sri Lanka,Weather-related disruptions expected. Stay informed about updates.,medium,[],2025-12-10T20:21:07.721913,2025-12-10T20:21:07.721962
1765378267725,Greek Bond case: Ex-CBSL Governor Cabraal released,"Former Central Bank Governor Ajith Nivard Cabraal has been released from the case pertaining to the 2012 purchase of Greek Bonds, subject to conditions, Ada Derana reporter said. MORE..",LIVE🔴Ada Derana Prime Time News Bulletin 6.55 pm,https://www.adaderana.lk/news/115832/greek-bond-case-ex-cbsl-governor-cabraal-released,ada_derana,general,general_news,Sri Lanka,General news update for public information,info,[],2025-12-10T20:21:07.725396,2025-12-10T20:21:07.725446
1765378267726,Case against Yoshitha and grandmother adjourned pending Daisy Forrests medical report,"The Attorney General informed the Colombo High Court today (10) that Daisy Forrest, the grandmother of Yoshitha Rajapaksa and a defendant in a case filed under the Prevention of Money Laundering Act, is scheduled to undergo a psychiatric medical report tomorrow by the Colombo Judicial Medical Officer. MORE..",LIVE🔴Ada Derana Prime Time News Bulletin 6.55 pm,https://www.adaderana.lk/news/115831/case-against-yoshitha-and-grandmother-adjourned-pending-daisy-forrests-medical-report,ada_derana,crime,court_legal_updates,Colombo,Law enforcement update for public information.,info,[],2025-12-10T20:21:07.726182,2025-12-10T20:21:07.726231
1765378267726,Homeowners in landslide-prone areas provided with reports on risk level: NBRO,The National Building Research Organisation (NBRO) has extended landslide warnings issued to several areas based on current ground conditions and weather forecasts. MORE..,LIVE🔴Ada Derana Prime Time News Bulletin 6.55 pm,https://www.adaderana.lk/news/115830/homeowners-in-landslide-prone-areas-provided-with-reports-on-risk-level-nbro-,ada_derana,weather,landslides,Sri Lanka,Weather-related disruptions expected. Stay informed about updates.,medium,[],2025-12-10T20:21:07.726830,2025-12-10T20:21:07.726874
1765378267730,Heavy vehicles barred from using road over Kotmale Dam: Mahaweli Authority,"Heavy vehicles have been barred from using the road over the Kotmale Dam, the Mahaweli Development Authority (MDA) has announced. MORE..",LIVE🔴Ada Derana Prime Time News Bulletin 6.55 pm,https://www.adaderana.lk/news/115829/heavy-vehicles-barred-from-using-road-over-kotmale-dam-mahaweli-authority,ada_derana,traffic,road_accident,Sri Lanka,Traffic information update for public awareness.,info,[],2025-12-10T20:21:07.730137,2025-12-10T20:21:07.730193
1765378267730,Kolonna Pradeshiya Sabhas budget defeated for the second time,"The annual budget of the Kolonna Pradeshiya Sabha, which is controlled by the National Peoples Power (NPP), has been defeated for the second time. MORE..",LIVE🔴Ada Derana Prime Time News Bulletin 6.55 pm,https://www.adaderana.lk/news/115828/kolonna-pradeshiya-sabhas-budget-defeated-for-the-second-time,ada_derana,general,general_news,Sri Lanka,General news update for public information,info,[],2025-12-10T20:21:07.730746,2025-12-10T20:21:07.730792
1765378267731,Family dog assists in locating bodies of seven victims in Ambokka landslide,"Highlands surrounding the Ambokka village within the Pallepola Divisional Secretariat area in Matale, have reportedly become increasingly unstable following recent heavy rains. MORE..",LIVE🔴Ada Derana Prime Time News Bulletin 6.55 pm,https://www.adaderana.lk/news/115827/family-dog-assists-in-locating-bodies-of-seven-victims-in-ambokka-landslide,ada_derana,weather,rainfall_alerts,Sri Lanka,Weather advisory in effect. Minor inconveniences possible.,low,[],2025-12-10T20:21:07.731488,2025-12-10T20:21:07.731537
1765378267732,H-1B visa appointments postponed for many Indians amid US Social Media rules,The US State Departments new social media vetting policy has triggered massive disruptions for H-1B visa applicants in India as many appointments have been postponed to next year. The US Embassy in India issued an advisory to the visa applicants on Tuesday night. MORE..,LIVE🔴Ada Derana Prime Time News Bulletin 6.55 pm,https://www.adaderana.lk/news/115826/h-1b-visa-appointments-postponed-for-many-indians-amid-us-social-media-rules,ada_derana,government,government_general,Sri Lanka,Policy changes announced. Impact on services expected.,medium,[],2025-12-10T20:21:07.732335,2025-12-10T20:21:07.732384
1765378267738,Google Maps begins updating Sri Lankas road network  Minister,"Google Maps has commenced updating information pertaining Sri Lankas road network covering around 12,000 kilometers, Minister of Transport Bimal Ratnayake has stated. MORE..",LIVE🔴Ada Derana Prime Time News Bulletin 6.55 pm,https://www.adaderana.lk/news/115825/google-maps-begins-updating-sri-lankas-road-network-minister,ada_derana,traffic,bus_issues,Sri Lanka,Traffic information update for public awareness.,info,[],2025-12-10T20:21:07.738178,2025-12-10T20:21:07.738237
1765378267738,"Rebuilding Sri Lanka Fund receives Rs. 1,893 million thus far","The Rebuilding Sri Lanka programme, initiated to restore the country following the damage caused by Cyclone Ditwah, has received a total of Rs. 1,893 million in funding from domestic sources, overseas Sri Lankans, and various institutions, the Secretary to the Ministry of Finance, Dr. Harshana Suriyapperuma has stated. MORE..",LIVE🔴Ada Derana Prime Time News Bulletin 6.55 pm,https://www.adaderana.lk/news/115824/rebuilding-sri-lanka-fund-receives-rs-1893-million-thus-far,ada_derana,weather,cyclones,Sri Lanka,Weather advisory in effect. Minor inconveniences possible.,low,[],2025-12-10T20:21:07.738972,2025-12-10T20:21:07.739018
1765378267739,"Over 50,000 tourists arrive in first eight days of December","A total of 50,222 tourists have arrived in the country thus far in December, data from the Sri Lanka Tourism Development Authority (SLTDA) shows. MORE..",LIVE🔴Ada Derana Prime Time News Bulletin 6.55 pm,https://www.adaderana.lk/news/115823/over-50000-tourists-arrive-in-first-eight-days-of-december,ada_derana,general,general_news,Sri Lanka,General news update for public information,info,[],2025-12-10T20:21:07.739487,2025-12-10T20:21:07.739539
1765378267741,"Landslide in Bogahapathana, no injuries or casualties reported","A landslide has been reported in Bogahapathana, Meegahakiula. MORE..",LIVE🔴Ada Derana Prime Time News Bulletin 6.55 pm,https://www.adaderana.lk/news/115821/landslide-in-bogahapathana-no-injuries-or-casualties-reported,ada_derana,weather,landslides,Sri Lanka,Weather advisory in effect. Minor inconveniences possible.,low,[],2025-12-10T20:21:07.741784,2025-12-10T20:21:07.741835
1765378346844,Thriposha company hands over Rs. 100 mln in dividends to Treasury,Sri Lanka Thriposha Limited has General Treasury handed over a sum of Rs. 100 million to the General Treasury as dividends. MORE..,LIVE🔴Ada Derana Prime Time News Bulletin 6.55 pm,https://www.adaderana.lk/news/115841/thriposha-company-hands-over-rs-100-mln-in-dividends-to-treasury,ada_derana,general,general_news,Sri Lanka,General news update for public information,info,[],2025-12-10T20:22:26.844677,2025-12-10T20:22:26.844808
1765378346850,Amended timetable of 2025 A/L examination released,"The Ministry of Education has decided that the subjects of the 2025 G.C.E. Advanced Level (A/L) examination which were postponed due to the adverse weather conditions in Sri Lanka will now be conducted from January 12 to January 20, 2026. MORE..",LIVE🔴Ada Derana Prime Time News Bulletin 6.55 pm,https://www.adaderana.lk/news/115840/amended-timetable-of-2025-al-examination-released,ada_derana,weather,weather_general,Sri Lanka,Weather information update for planning purposes.,info,[],2025-12-10T20:22:26.850829,2025-12-10T20:22:26.851144
1765378346854,Notice on reopening preschools and early childhood development centers,All preschools and early childhood development centers that were closed due to the emergency disaster situation and are now deemed safe to resume operations will be reopened from 16 December 2025. MORE..,LIVE🔴Ada Derana Prime Time News Bulletin 6.55 pm,https://www.adaderana.lk/news/115839/notice-on-reopening-preschools-and-early-childhood-development-centers-,ada_derana,safety,rescue_operations,Sri Lanka,Emergency safety situation requiring immediate attention and precautions.,high,[],2025-12-10T20:22:26.854172,2025-12-10T20:22:26.854409
1765378346860,Russias first aircraft carrying 35 tons of humanitarian aid arrives in Sri Lanka,Russia has dispatched a consignment of 35 metric tons of humanitarian aid to Sri Lanka following the impact of Cyclone Ditwah. MORE..,LIVE🔴Ada Derana Prime Time News Bulletin 6.55 pm,https://www.adaderana.lk/news/115838/russias-first-aircraft-carrying-35-tons-of-humanitarian-aid-arrives-in-sri-lanka,ada_derana,weather,cyclones,Sri Lanka,Weather information update for planning purposes.,info,[],2025-12-10T20:22:26.860225,2025-12-10T20:22:26.860373
1765378346862,Australia and UNFPA partner to protect women and girls in cyclone-affected Sri Lanka,"Australia and the United Nations Population Fund (UNFPA) have partnered to deliver urgent humanitarian assistance to protect women and girls across Sri Lanka, affected by catastrophic floods and landslides triggered by Cyclone Ditwah, one of the most devastating climate-related disasters to strike the island nation in recent years. MORE..",LIVE🔴Ada Derana Prime Time News Bulletin 6.55 pm,https://www.adaderana.lk/news/115837/australia-and-unfpa-partner-to-protect-women-and-girls-in-cyclone-affected-sri-lanka,ada_derana,weather,floods,Sri Lanka,Severe weather conditions posing risks to public safety. Follow official warnings.,high,[],2025-12-10T20:22:26.862099,2025-12-10T20:22:26.862269
1765378346865,Deepavali inscribed on UNESCOs Intangible Cultural Heritage list,"Deepavali  the festival of lights  was on Wednesday (December 10, 2025) inscribed on the UNESCOs Representative List of the Intangible Cultural Heritage of Humanity, sparking celebrations to mark the earning of the coveted tag. MORE..",LIVE🔴Ada Derana Prime Time News Bulletin 6.55 pm,https://www.adaderana.lk/news/115836/deepavali-inscribed-on-unescos-intangible-cultural-heritage-list,ada_derana,community,community_general,Sri Lanka,General information update for public awareness.,info,[],2025-12-10T20:22:26.865167,2025-12-10T20:22:26.865277
1765378346866,UAE continues to send aid to assist flood-hit Sri Lanka,The UAEs eight humanitarian aid aircraft has arrived in Sri Lanka on Tuesday in efforts to support the country following deadly floods and landslides. MORE..,LIVE🔴Ada Derana Prime Time News Bulletin 6.55 pm,https://www.adaderana.lk/news/115835/uae-continues-to-send-aid-to-assist-flood-hit-sri-lanka,ada_derana,weather,floods,Sri Lanka,Severe weather conditions posing risks to public safety. Follow official warnings.,high,[],2025-12-10T20:22:26.866708,2025-12-10T20:22:26.866802
1765378346868,Advisory issued for severe lightning,An Amber advisory has been issued by the Department of Meteorology for severe lightning in the Western and Sabaragamuwa provinces and in Galle and Matara Districts. MORE..,LIVE🔴Ada Derana Prime Time News Bulletin 6.55 pm,https://www.adaderana.lk/news/115834/advisory-issued-for-severe-lightning,ada_derana,general,general_news,Sri Lanka,General news update for public information,info,[],2025-12-10T20:22:26.868730,2025-12-10T20:22:26.868831
1765378346870,"Significant flooding reported after heavy rainfall in Jeddah, Saudi Arabia","Jeddah, Saudi Arabia has experienced heavy rainfall that has led to significant flooding and traffic congestion across the city. MORE..",LIVE🔴Ada Derana Prime Time News Bulletin 6.55 pm,https://www.adaderana.lk/news/115833/significant-flooding-reported-after-heavy-rainfall-in-jeddah-saudi-arabia,ada_derana,weather,rainfall_alerts,Sri Lanka,Weather-related disruptions expected. Stay informed about updates.,medium,[],2025-12-10T20:22:26.870260,2025-12-10T20:22:26.870363
1765378346872,Greek Bond case: Ex-CBSL Governor Cabraal released,"Former Central Bank Governor Ajith Nivard Cabraal has been released from the case pertaining to the 2012 purchase of Greek Bonds, subject to conditions, Ada Derana reporter said. MORE..",LIVE🔴Ada Derana Prime Time News Bulletin 6.55 pm,https://www.adaderana.lk/news/115832/greek-bond-case-ex-cbsl-governor-cabraal-released,ada_derana,general,general_news,Sri Lanka,General news update for public information,info,[],2025-12-10T20:22:26.872804,2025-12-10T20:22:26.872989
1765378346874,Case against Yoshitha and grandmother adjourned pending Daisy Forrests medical report,"The Attorney General informed the Colombo High Court today (10) that Daisy Forrest, the grandmother of Yoshitha Rajapaksa and a defendant in a case filed under the Prevention of Money Laundering Act, is scheduled to undergo a psychiatric medical report tomorrow by the Colombo Judicial Medical Officer. MORE..",LIVE🔴Ada Derana Prime Time News Bulletin 6.55 pm,https://www.adaderana.lk/news/115831/case-against-yoshitha-and-grandmother-adjourned-pending-daisy-forrests-medical-report,ada_derana,crime,court_legal_updates,Colombo,Law enforcement update for public information.,info,[],2025-12-10T20:22:26.874190,2025-12-10T20:22:26.874298
1765378346878,Homeowners in landslide-prone areas provided with reports on risk level: NBRO,The National Building Research Organisation (NBRO) has extended landslide warnings issued to several areas based on current ground conditions and weather forecasts. MORE..,LIVE🔴Ada Derana Prime Time News Bulletin 6.55 pm,https://www.adaderana.lk/news/115830/homeowners-in-landslide-prone-areas-provided-with-reports-on-risk-level-nbro-,ada_derana,weather,landslides,Sri Lanka,Weather-related disruptions expected. Stay informed about updates.,medium,[],2025-12-10T20:22:26.878473,2025-12-10T20:22:26.878595
1765378346883,Heavy vehicles barred from using road over Kotmale Dam: Mahaweli Authority,"Heavy vehicles have been barred from using the road over the Kotmale Dam, the Mahaweli Development Authority (MDA) has announced. MORE..",LIVE🔴Ada Derana Prime Time News Bulletin 6.55 pm,https://www.adaderana.lk/news/115829/heavy-vehicles-barred-from-using-road-over-kotmale-dam-mahaweli-authority,ada_derana,traffic,road_accident,Sri Lanka,Traffic information update for public awareness.,info,[],2025-12-10T20:22:26.883643,2025-12-10T20:22:26.883751
1765378346886,Kolonna Pradeshiya Sabhas budget defeated for the second time,"The annual budget of the Kolonna Pradeshiya Sabha, which is controlled by the National Peoples Power (NPP), has been defeated for the second time. MORE..",LIVE🔴Ada Derana Prime Time News Bulletin 6.55 pm,https://www.adaderana.lk/news/115828/kolonna-pradeshiya-sabhas-budget-defeated-for-the-second-time,ada_derana,general,general_news,Sri Lanka,General news update for public information,info,[],2025-12-10T20:22:26.886022,2025-12-10T20:22:26.886128
1765378346887,Family dog assists in locating bodies of seven victims in Ambokka landslide,"Highlands surrounding the Ambokka village within the Pallepola Divisional Secretariat area in Matale, have reportedly become increasingly unstable following recent heavy rains. MORE..",LIVE🔴Ada Derana Prime Time News Bulletin 6.55 pm,https://www.adaderana.lk/news/115827/family-dog-assists-in-locating-bodies-of-seven-victims-in-ambokka-landslide,ada_derana,weather,rainfall_alerts,Sri Lanka,Weather advisory in effect. Minor inconveniences possible.,low,[],2025-12-10T20:22:26.887473,2025-12-10T20:22:26.887609
1765378346890,H-1B visa appointments postponed for many Indians amid US Social Media rules,The US State Departments new social media vetting policy has triggered massive disruptions for H-1B visa applicants in India as many appointments have been postponed to next year. The US Embassy in India issued an advisory to the visa applicants on Tuesday night. MORE..,LIVE🔴Ada Derana Prime Time News Bulletin 6.55 pm,https://www.adaderana.lk/news/115826/h-1b-visa-appointments-postponed-for-many-indians-amid-us-social-media-rules,ada_derana,government,government_general,Sri Lanka,Policy changes announced. Impact on services expected.,medium,[],2025-12-10T20:22:26.890571,2025-12-10T20:22:26.890684
1765378346894,Google Maps begins updating Sri Lankas road network  Minister,"Google Maps has commenced updating information pertaining Sri Lankas road network covering around 12,000 kilometers, Minister of Transport Bimal Ratnayake has stated. MORE..",LIVE🔴Ada Derana Prime Time News Bulletin 6.55 pm,https://www.adaderana.lk/news/115825/google-maps-begins-updating-sri-lankas-road-network-minister,ada_derana,traffic,bus_issues,Sri Lanka,Traffic information update for public awareness.,info,[],2025-12-10T20:22:26.894533,2025-12-10T20:22:26.894741
1765378346899,"Rebuilding Sri Lanka Fund receives Rs. 1,893 million thus far","The Rebuilding Sri Lanka programme, initiated to restore the country following the damage caused by Cyclone Ditwah, has received a total of Rs. 1,893 million in funding from domestic sources, overseas Sri Lankans, and various institutions, the Secretary to the Ministry of Finance, Dr. Harshana Suriyapperuma has stated. MORE..",LIVE🔴Ada Derana Prime Time News Bulletin 6.55 pm,https://www.adaderana.lk/news/115824/rebuilding-sri-lanka-fund-receives-rs-1893-million-thus-far,ada_derana,weather,cyclones,Sri Lanka,Weather advisory in effect. Minor inconveniences possible.,low,[],2025-12-10T20:22:26.899093,2025-12-10T20:22:26.899200
1765378346900,"Over 50,000 tourists arrive in first eight days of December","A total of 50,222 tourists have arrived in the country thus far in December, data from the Sri Lanka Tourism Development Authority (SLTDA) shows. MORE..",LIVE🔴Ada Derana Prime Time News Bulletin 6.55 pm,https://www.adaderana.lk/news/115823/over-50000-tourists-arrive-in-first-eight-days-of-december,ada_derana,general,general_news,Sri Lanka,General news update for public information,info,[],2025-12-10T20:22:26.900639,2025-12-10T20:22:26.900739
